{
  "schema_version": 1,
  "system_id": "customer-odoo",
  "run_id": "RUN-2026-09-0001",
  "run_kind": "requirement_intake",
  "revision": 1,
  "state": "preflight",
  "last_event_id": "EVT-2026-09-0001",
  "updated_at": "2026-09-05T14:30:01-04:00",
  "tasks": [
    {
      "task_id": "review_requirement",
      "state": "pending",
      "depends_on": []
    },
    {
      "task_id": "create_sidecars",
      "state": "pending",
      "depends_on": ["review_requirement"]
    }
  ]
}
